{
  "compute_formula": "Y[n,k] = sum_m X[n,m,k]",
  "compute_note": {
    "description": "对输入 X 沿 M 轴求和。",
    "torch_impl": "Y = X.sum(dim=1)"
  },
  "fusion_note": "融合: N + K -> NK",
  "io_block_mapping": {
    "X_ptr": {
      "block_name": {"NK": "BLOCK_NK"},
      "axis_size": {"NK": [2048]},
      "reduce_dim": {"M": "BLOCK_M"},
      "reduce_size": {"M": [32]},
      "contiguity": [true, true]
    },
    "Y_ptr": {
      "block_name": {"NK": "BLOCK_NK"},
      "axis_size": {"NK": [2048]},
      "contiguity": [true]
    }
  }
}
